question_id,question,target_doc_id,plm_rank,plm_latency_ms,enriched_rank,enriched_latency_ms,naive_rank,naive_latency_ms
"q_081_q2","my kubernetes cluster is not validating tokens from my identity provider","reference_access-authn-authz_authentication",2,286.91,1,128.34,1,73.88
"q_082_q1","why can't I see my kubernetes cluster's tracing data","concepts_cluster-administration_system-traces",2,316.89,,162.32,,77.12
"q_082_q2","how to configure my monitoring tool to collect telemetry from k8s components","concepts_cluster-administration_system-traces",,306.21,5,109.50,4,80.40
"q_083_q1","remove default storage option so our team chooses specific storage for each deployment","tasks_administer-cluster_change-default-storage-class",2,303.61,3,105.46,,71.25
"q_083_q2","getting errors when provisioning volumes because wrong storage class keeps getting selected","tasks_administer-cluster_change-default-storage-class",4,416.99,,103.72,4,57.68
"q_084_q1","how to check if my network plugin is running and healthy","tasks_administer-cluster_network-policy-provider_cilium-network-policy",,278.81,,106.43,,67.86
"q_084_q2","can't figure out why my cluster network isn't working - which pods should I look at","tasks_administer-cluster_network-policy-provider_cilium-network-policy",,310.12,,116.15,,61.10
"q_085_q1","service account can't access kubernetes api resources inside my pod","reference_access-authn-authz_rbac",,321.06,,112.19,,80.38
"q_085_q2","how to give my pod permissions to list deployments in the cluster","reference_access-authn-authz_rbac",,317.32,,149.44,,110.32
"q_086_q1","how to prevent one team from consuming all cluster resources and blocking other teams","concepts_policy_resource-quotas",1,431.52,5,107.51,,57.21
"q_086_q2","getting errors when trying to create pods in a namespace that's out of compute resources","concepts_policy_resource-quotas",,283.93,3,130.45,4,139.12
"q_087_q1","how to debug a container when the main app process crashes and won't start","concepts_workloads_pods_ephemeral-containers",,302.97,,99.88,,117.18
"q_087_q2","can't diagnose why my container is stuck in a restart loop","concepts_workloads_pods_ephemeral-containers",,292.86,,112.97,,58.25
"q_088_q1","why can't my services get an IP address within the expected range","tasks_network_extend-service-ip-ranges",,284.60,,119.03,,109.82
"q_088_q2","getting network conflicts when deploying new services in my cluster","tasks_network_extend-service-ip-ranges",,432.30,,133.66,,69.23
"q_089_q1","how to generate and sign tls certificates for internal services securely","tasks_administer-cluster_certificates",4,282.98,2,164.12,2,78.81
"q_089_q2","create self-signed certificates for my kubernetes cluster without manual openssl commands","tasks_administer-cluster_certificates",1,313.04,1,116.84,,74.12
"q_090_q1","why does my container startup fail when additional containers are added to the pod","concepts_workloads_pods_init-containers",1,307.75,1,118.57,3,71.24
"q_090_q2","how to ensure my initialization container doesn't consume all pod resources before main container starts","concepts_workloads_pods_init-containers",2,296.80,1,154.05,2,101.97
"q_091_q1","how to track which pods are consuming the most CPU and memory in my cluster","tasks_debug_debug-cluster_resource-usage-monitoring",,409.72,,119.67,,58.38
"q_091_q2","get alerts when my services are running out of resources before they crash","tasks_debug_debug-cluster_resource-usage-monitoring",,293.43,,152.07,,64.17
"q_092_q1","how do i update network settings without breaking cluster connectivity","tasks_administer-cluster_migrating-from-dockershim_troubleshooting-cni-plugin-related-errors",,306.73,,122.44,4,89.49
"q_092_q2","getting connection errors after changing network plugin configuration","tasks_administer-cluster_migrating-from-dockershim_troubleshooting-cni-plugin-related-errors",2,283.55,3,150.18,2,78.38
"q_093_q1","how to request a custom GPU resource for machine learning workloads","tasks_configure-pod-container_extended-resource",,291.80,,133.62,,92.29
"q_093_q2","container keeps failing to schedule because of missing hardware resources","tasks_configure-pod-container_extended-resource",,441.88,,132.27,,112.62
"q_094_q1","why can't I find a persistent volume for my database when using empty selectors","concepts_storage_persistent-volumes",,398.49,,136.56,,66.38
"q_094_q2","how do I make sure my claim gets the exact storage I want without guessing","concepts_storage_persistent-volumes",3,329.11,1,173.03,1,76.92
"q_095_q1","why can't my developer access resources in our team's namespace","reference_access-authn-authz_rbac",,285.55,,90.80,,78.38
"q_095_q2","how to give new team member permissions to view and edit specific deployments","reference_access-authn-authz_rbac",,288.44,,119.59,,75.77
"q_096_q1","how can I test my yaml changes without actually creating resources in my cluster","reference_access-authn-authz_extensible-admission-controllers",,432.32,,76.96,,89.28
"q_096_q2","is there a way to validate my kubernetes manifest before it goes live","reference_access-authn-authz_extensible-admission-controllers",,346.44,,132.52,,56.69
"q_097_q1","how to update container image in a running deployment without downtime","tasks_manage-kubernetes-objects_imperative-config",,287.82,,118.41,,55.42
"q_097_q2","change environment variables for a live pod without recreating it","tasks_manage-kubernetes-objects_imperative-config",,322.26,,83.83,,80.98
"q_098_q1","why is my background job processing so slow when I have multiple workers available","tasks_job_coarse-parallel-processing-work-queue",,297.95,,125.72,2,71.30
"q_098_q2","how to control the number of concurrent workers processing my task queue","tasks_job_coarse-parallel-processing-work-queue",2,406.92,,140.93,1,69.79
"q_099_q1","why can't my team member access resources in our namespace","reference_access-authn-authz_rbac",,301.23,,117.79,,56.82
"q_099_q2","how to give a service account permission to manage deployments cluster-wide","reference_access-authn-authz_rbac",1,277.03,1,113.11,1,157.76
"q_100_q1","my mysql database keeps losing data when pods restart in kubernetes","tasks_run-application_run-single-instance-stateful-application",,320.87,5,114.20,1,63.82
"q_100_q2","how to run a stable mysql cluster that preserves data across pod rescheduling","tasks_run-application_run-single-instance-stateful-application",3,315.34,,122.88,2,102.63
"q_101_q1","why are my pods getting evicted when there's still memory on the node","tasks_configure-pod-container_assign-cpu-resource",,398.73,,95.14,,75.13
"q_101_q2","one of my containers is hogging all the node's resources and starving other pods","tasks_configure-pod-container_assign-cpu-resource",4,313.44,1,136.42,4,98.98
"q_102_q1","how to set up database replication in kubernetes with one master and multiple read replicas","tasks_run-application_run-replicated-stateful-application",,296.89,2,129.94,4,63.33
"q_102_q2","my database cluster keeps losing data when the main node goes down","tasks_run-application_run-replicated-stateful-application",,306.21,2,100.18,4,54.49
"q_103_q1","how to make google kubernetes engine block pod-to-pod communication by default","tasks_administer-cluster_network-policy-provider_calico-network-policy",,285.60,,112.81,,116.91
"q_103_q2","why can all my pods talk to each other even though i want network isolation","tasks_administer-cluster_network-policy-provider_calico-network-policy",,426.91,,98.41,,61.72
"q_104_q1","how to upgrade my kubernetes cluster without causing service interruption","tasks_administer-cluster_kubeadm_kubeadm-upgrade",2,298.01,,156.87,,77.46
"q_104_q2","my nodes are showing warning about kubernetes version mismatch and i'm worried about stability","tasks_administer-cluster_kubeadm_kubeadm-upgrade",,370.40,,112.61,4,59.24
"q_105_q1","how to give my admin user full permissions across all kubernetes resources","reference_access-authn-authz_abac",,295.60,,108.93,,69.75
"q_105_q2","user can't manage anything in the cluster and I want to grant complete access","reference_access-authn-authz_abac",,305.30,,95.62,,72.23
"q_106_q1","why can't I delete a persistent volume claim that's being used by a running pod","concepts_storage_persistent-volumes",2,422.05,,122.87,,104.70
"q_106_q2","my volume deletion fails even though I stopped using the storage","concepts_storage_persistent-volumes",2,326.32,,119.35,,87.09
"q_107_q1","why are my custom resource manifests showing warnings when i deploy to the cluster","tasks_extend-kubernetes_custom-resources_custom-resource-definition-versioning",,291.33,,136.34,,96.86
"q_107_q2","how to handle kubernetes warnings when upgrading custom resource definitions","tasks_extend-kubernetes_custom-resources_custom-resource-definition-versioning",,282.54,2,118.44,3,79.83
"q_108_q1","why can't I connect my local development environment to my kubernetes cluster","tasks_debug_debug-cluster_local-debugging",2,379.90,,62.93,,71.34
"q_108_q2","how to test my service code running locally against remote kubernetes services","tasks_debug_debug-cluster_local-debugging",1,430.14,1,125.99,1,68.57
"q_109_q1","how to track which users are making changes in my kubernetes cluster","concepts_security_controlling-access",,279.85,5,121.94,,82.26
"q_109_q2","get a log of all security-related events for compliance reporting","concepts_security_controlling-access",,307.46,,111.39,,142.92
"q_110_q1","my api requests to kubernetes cluster failing and not sure why","concepts_overview_kubernetes-api",,307.52,,119.62,,58.19
"q_110_q2","how to debug connection problems between my tool and kubernetes control plane","concepts_overview_kubernetes-api",,330.30,,158.51,,73.41
"q_111_q1","why are my services not routing traffic to all my pods correctly","concepts_services-networking_endpoint-slices",,466.96,,96.55,,76.79
"q_111_q2","is there a way to handle more than 100 pod endpoints in a single service","concepts_services-networking_endpoint-slices",,297.35,2,160.49,2,55.20
"q_112_q1","why is my kubernetes cluster preventing me from attaching more ebs volumes to a node","concepts_storage_storage-limits",1,331.72,1,142.09,1,88.75
"q_112_q2","how many persistent volumes can i attach to a single worker node","concepts_storage_storage-limits",1,298.17,1,102.09,1,55.79
"q_113_q1","my docker container loses all data when it restarts or gets rescheduled","concepts_storage_volumes",1,288.96,,115.70,,93.60
"q_113_q2","how to preserve files created inside a container between pod restarts","concepts_storage_volumes",1,393.82,2,98.72,,52.03
"q_114_q1","how can I confirm the download of my software package wasn't tampered with","tasks_administer-cluster_verify-signed-artifacts",,337.56,2,108.60,4,81.97
"q_114_q2","why does my security team require checking gpg signatures before installing software","tasks_administer-cluster_verify-signed-artifacts",,306.77,,182.13,4,59.01
"q_115_q1","my kubernetes cluster stopped working after trying to update certificates","tasks_tls_manual-rotation-of-ca-certificates",1,281.71,1,116.82,2,95.75
"q_115_q2","how to safely renew cluster's root certificates without breaking everything","tasks_tls_manual-rotation-of-ca-certificates",,365.57,,72.68,,62.07
"q_116_q1","how to prevent my container from consuming all host machine's CPU resources","concepts_policy_pid-limiting",,405.53,,125.65,,136.95
"q_116_q2","why is my kubernetes node crashing when a pod starts consuming too many processes","concepts_policy_pid-limiting",1,295.52,1,119.36,4,79.19
"q_117_q1","node keeps kicking out my pods when memory is low and breaking my application","tasks_administer-cluster_memory-manager",,314.48,,123.51,,69.72
"q_117_q2","how to prevent kubernetes from forcibly removing pods during high memory pressure","tasks_administer-cluster_memory-manager",,318.94,,106.08,,62.79
"q_118_q1","how do I separate environments like dev and staging in my cluster","tasks_administer-cluster_manage-resources_quota-pod-namespace",,312.30,,196.86,,75.59
"q_118_q2","getting permission issues when deploying to a new project team's area","tasks_administer-cluster_manage-resources_quota-pod-namespace",,419.82,,152.76,,86.20
"q_119_q1","why are my kubernetes cluster certificates about to expire and causing connection issues","tasks_tls_manual-rotation-of-ca-certificates",,332.29,,104.84,,86.15
"q_119_q2","how do I safely update cluster certificates without breaking everything","tasks_tls_manual-rotation-of-ca-certificates",4,343.92,,153.72,,121.69
"q_120_q1","can containers see and kill processes running in other containers on the same node","tasks_configure-pod-container_share-process-namespace",,287.33,1,101.30,1,60.22
"q_120_q2","security risks when multiple containers share the same process namespace","tasks_configure-pod-container_share-process-namespace",1,303.15,1,114.20,2,99.90
"q_121_q1","why kubernetes ignores some of my environment variables when deploying my app","tasks_inject-data-application_define-environment-variable-container",,486.72,,164.11,,162.67
"q_121_q2","how to load all environment variables from a config file without listing them manually","tasks_inject-data-application_define-environment-variable-container",3,345.09,,145.18,,60.90
"q_122_q1","how to automatically generate certificates for new worker nodes joining my cluster","reference_access-authn-authz_kubelet-tls-bootstrapping",,330.79,3,186.75,,95.83
"q_122_q2","my kubelet can't authenticate to the kubernetes api server without manual certificate signing","reference_access-authn-authz_kubelet-tls-bootstrapping",,440.36,1,126.28,1,97.93
"q_123_q1","why are my system monitoring pods not updating when i deploy a new version","tasks_manage-daemon_update-daemon-set",,320.40,,158.86,,127.50
"q_123_q2","how can i tell if my daemonset will replace pods all at once or gradually","tasks_manage-daemon_update-daemon-set",2,428.94,3,146.63,,117.14
"q_124_q1","why are my cpu-intensive pods running slow and spreading across different numa nodes","concepts_architecture_nodes",,258.22,,95.28,,44.33
"q_124_q2","how to ensure container gets optimal cpu and memory placement on worker nodes","concepts_architecture_nodes",,280.88,,78.45,,35.35
"q_125_q1","my external users can't reach my service from the internet","concepts_services-networking_ingress",,248.04,,85.68,,60.52
"q_125_q2","how to route different domains to different services in kubernetes","concepts_services-networking_ingress",,276.46,,90.73,,103.47
"q_126_q1","how to add environment variables to my container without changing the dockerfile","tasks_inject-data-application_environment-variable-expose-pod-information",,375.33,,88.82,,41.74
"q_126_q2","my app needs runtime config but i can't modify the image's environment","tasks_inject-data-application_environment-variable-expose-pod-information",,280.86,,97.28,,68.38
"q_127_q1","how to automatically set up permissions for new team members when they join","reference_access-authn-authz_rbac",3,251.76,,79.67,5,42.57
"q_127_q2","getting permission denied errors for developers trying to access their namespace","reference_access-authn-authz_rbac",3,328.69,,48.85,,45.93
"q_128_q1","why are all my pods running on the same node even though I have multiple zones","setup_best-practices_multiple-zones",,310.58,,77.90,,42.25
"q_128_q2","how to ensure my application stays available if an entire cloud zone goes down","setup_best-practices_multiple-zones",,397.83,,108.02,,62.94
"q_129_q1","why did my container exit immediately after starting without showing any error","tasks_configure-pod-container_attach-handler-lifecycle-event",,291.54,,79.99,,32.53
"q_129_q2","how to debug what's happening when kubernetes launches my container","tasks_configure-pod-container_attach-handler-lifecycle-event",,269.08,,130.88,,43.31
"q_130_q1","which snapshot driver to use for different storage systems like aws ebs or gcp persistent disk","concepts_storage_volume-snapshot-classes",,252.05,,109.05,,44.99
"q_130_q2","error creating volume snapshots and not sure how to configure the right storage backend","concepts_storage_volume-snapshot-classes",4,270.48,,113.00,,38.59
"q_131_q1","how can I check if my database container is actually using the persistent volume","tasks_configure-pod-container_configure-volume-storage",4,383.03,,121.86,,48.97
"q_131_q2","why isn't my volume showing up inside the container's filesystem","tasks_configure-pod-container_configure-volume-storage",4,260.33,,82.59,,49.96
"q_132_q1","why my node seems disconnected and kubernetes can't schedule new pods","concepts_architecture_control-plane-node-communication",,263.82,,86.68,,39.88
"q_132_q2","how to troubleshoot communication issues between control plane and worker nodes","concepts_architecture_control-plane-node-communication",,249.75,,82.17,3,31.89
"q_133_q1","why can't I edit a ClusterRole binding after creating it","reference_access-authn-authz_rbac",1,287.62,1,94.48,1,50.51
"q_133_q2","getting permission denied when trying to update role permissions mid-project","reference_access-authn-authz_rbac",1,428.66,1,150.47,2,52.17
"q_134_q1","why do my windows containers keep crashing when deployed on kubernetes cluster","tasks_debug_debug-cluster_windows",1,254.12,1,152.69,1,36.16
"q_134_q2","is there a way to run windows and linux pods together in the same cluster","tasks_debug_debug-cluster_windows",,255.14,,104.49,,36.15
"q_135_q1","how to run database backup script every night automatically in kubernetes","concepts_workloads_controllers_cron-jobs",,259.91,,103.52,,36.53
"q_135_q2","schedule batch job to clean up old logs without manual intervention","concepts_workloads_controllers_cron-jobs",,253.09,,168.59,,55.84
"q_136_q1","how to pass database connection strings to my app without hardcoding secrets","tasks_extend-kubernetes_configure-multiple-schedulers",,383.33,,79.90,,61.01
"q_136_q2","change application environment variables without rebuilding docker image","tasks_extend-kubernetes_configure-multiple-schedulers",,255.95,,124.11,,38.34
"q_137_q1","how to customize dns settings for a specific pod that's having weird network resolution issues","concepts_services-networking_dns-pod-service",1,259.32,2,121.58,2,41.77
"q_137_q2","can I override default dns settings for a container that needs to use a custom nameserver","concepts_services-networking_dns-pod-service",2,255.90,5,81.24,2,38.30
"q_138_q1","how to run a web app with a separate logging container that shares the same network space","tasks_access-application-cluster_communicate-containers-same-pod-shared-volume",,259.81,,91.77,,36.98
"q_138_q2","my application needs a helper container to process files before main container starts","tasks_access-application-cluster_communicate-containers-same-pod-shared-volume",,375.73,,123.98,,50.20
"q_139_q1","how to download and install kubernetes command line tool on my mac","tasks_tools_install-kubectl-macos",4,257.16,1,123.95,1,53.55
"q_139_q2","getting error when trying to manage clusters from my macbook","tasks_tools_install-kubectl-macos",,252.58,,109.39,,36.88
"q_140_q1","why are my pods getting stuck in pending state and not scheduling","tasks_administer-cluster_manage-resources_cpu-constraint-namespace",,255.22,,86.89,,58.63
"q_140_q2","kubernetes throwing error when trying to deploy app with specific memory requirements","tasks_administer-cluster_manage-resources_cpu-constraint-namespace",,249.49,,94.51,,38.50
"q_141_q1","how to mount azure file share directly into kubernetes pod without complex storage config","concepts_storage_volumes",2,376.27,5,86.71,,44.70
"q_141_q2","my windows containers need persistent storage that works across multiple pods","concepts_storage_volumes",,278.15,,80.39,,35.89
"q_142_q1","how to package my application with all dependencies so it runs consistently everywhere","tasks_job_coarse-parallel-processing-work-queue",,285.21,,124.48,,61.00
"q_142_q2","why my application works on my laptop but fails when deployed to different environments","tasks_job_coarse-parallel-processing-work-queue",,300.73,,113.27,,41.88
"q_143_q1","how to set an environment variable based on another environment variable's value","tasks_inject-data-application_define-interdependent-environment-variables",2,249.72,4,80.15,5,34.82
"q_143_q2","container can't read dynamic value from another config setting","tasks_inject-data-application_define-interdependent-environment-variables",,387.33,,122.48,,51.86
"q_144_q1","why can't my new ubuntu nodes join the kubernetes cluster after kernel upgrade","concepts_architecture_cgroups",,263.07,,78.40,,47.26
"q_144_q2","how to make docker work correctly on systems with newer linux kernels","concepts_architecture_cgroups",,254.25,,79.86,,44.83
"q_145_q1","how do I get auto-completion for kubectl commands in my terminal","tasks_tools_included_optional-kubectl-configs-bash-linux",5,310.85,1,106.50,1,39.51
"q_145_q2","why aren't my kubernetes command suggestions working in bash","tasks_tools_included_optional-kubectl-configs-bash-linux",2,286.33,4,82.62,3,50.95
"q_146_q1","my kubernetes controllers are crashing during leader election when upgrading cluster version","tasks_administer-cluster_controller-manager-leader-migration",1,429.12,1,99.72,1,38.78
"q_146_q2","how to smoothly transition controller leadership without downtime during cluster upgrades","tasks_administer-cluster_controller-manager-leader-migration",,248.90,2,92.54,1,38.85
"q_147_q1","how to log all changes made to my kubernetes cluster for compliance","tasks_debug_debug-cluster_audit",,250.27,,107.53,,68.24
"q_147_q2","reduce performance impact of kubernetes audit logging on my production cluster","tasks_debug_debug-cluster_audit",5,254.27,5,108.55,4,36.80
"q_148_q1","kubernetes api server becoming unresponsive during high traffic spike","concepts_cluster-administration_flow-control",,252.15,,125.13,,36.11
"q_148_q2","how to prevent single user or service from overwhelming cluster api requests","concepts_cluster-administration_flow-control",4,376.83,,82.79,,66.55
"q_149_q1","why can't I configure my ingress gateway settings without complex custom resources","concepts_services-networking_gateway",1,260.52,2,98.38,1,47.04
"q_149_q2","how do I manage multiple gateways and routes across different teams and services","concepts_services-networking_gateway",2,257.78,2,85.20,,51.93
"q_150_q1","how to fix a stuck kubernetes cluster upgrade that's hanging midway","tasks_administer-cluster_kubeadm_kubeadm-upgrade",,263.97,,95.78,4,55.77
"q_150_q2","my control plane upgrade failed and now cluster is in a weird state","tasks_administer-cluster_kubeadm_kubeadm-upgrade",1,256.17,2,104.79,3,48.28
"q_151_q1","my application keeps crashing and I want to automatically restart the pod","tasks_access-application-cluster_port-forward-access-application-cluster",,374.20,,138.48,,47.74
"q_151_q2","how do I run multiple copies of my web app to handle more traffic","tasks_access-application-cluster_port-forward-access-application-cluster",,245.46,,121.06,,82.84
"q_152_q1","how do I approve certificate signing requests for my new service account","reference_access-authn-authz_certificate-signing-requests",,251.90,,96.39,,40.42
"q_152_q2","getting 'unable to validate certificate' error when trying to connect to cluster","reference_access-authn-authz_certificate-signing-requests",,328.78,,123.97,5,65.37
"q_153_q1","how to run a one-time database migration script in my kubernetes cluster","concepts_overview_working-with-objects_object-management",,258.08,,90.59,,48.38
"q_153_q2","my data processing job keeps failing and I want to run it manually to debug","concepts_overview_working-with-objects_object-management",,462.52,,114.46,,54.34
"q_154_q1","my certificate management system is creating weird kubernetes objects that don't seem connected","reference_access-authn-authz_certificate-signing-requests",,250.79,,79.80,,66.46
"q_154_q2","how to handle trust bundles for services that need multiple certificate authorities","reference_access-authn-authz_certificate-signing-requests",4,336.78,,139.61,2,110.14
"q_155_q1","why are my pods all landing on the same node when I want them spread out","concepts_scheduling-eviction_topology-spread-constraints",1,283.48,1,151.62,1,148.88
"q_155_q2","how can I make sure my replicas are evenly distributed across different availability zones","concepts_scheduling-eviction_topology-spread-constraints",,306.52,,137.23,1,84.67
"q_156_q1","how to run a command in my container that looks like a kubectl flag","tasks_debug_debug-application_get-shell-running-container",,390.23,,120.61,,54.47
"q_156_q2","container command not working when using kubectl exec with arguments","tasks_debug_debug-application_get-shell-running-container",2,260.55,4,101.82,4,45.54
"q_157_q1","why can't I schedule pods on nodes with specific labels like 'high-memory'","concepts_scheduling-eviction_assign-pod-node",2,264.93,5,90.11,4,34.30
"q_157_q2","how to prevent pods from running on nodes with GPU when we have no GPU workloads","concepts_scheduling-eviction_assign-pod-node",,256.46,,95.21,,37.29
"q_158_q1","how to pass database password to my app without hardcoding it in dockerfile","tasks_inject-data-application_distribute-credentials-secure",,253.30,3,84.83,,37.29
"q_158_q2","kubernetes pods not picking up sensitive config values from environment","tasks_inject-data-application_distribute-credentials-secure",,457.97,,81.24,,74.42
"q_159_q1","why can't I map multiple application ports in a single kubernetes service","concepts_services-networking_service",1,259.89,1,92.02,1,43.63
"q_159_q2","how to expose two different ports for the same microservice","concepts_services-networking_service",1,318.09,2,88.78,2,60.21
"q_160_q1","how can I expose my web application to the internet from kubernetes","concepts_services-networking_service",2,262.44,,135.26,,63.30
