question_id,question,target_doc_id,plm_rank,plm_latency_ms,enriched_rank,enriched_latency_ms,naive_rank,naive_latency_ms
"q_160_q2","getting error when trying to access my app from outside the cluster","concepts_services-networking_service",,258.17,,75.36,,45.47
"q_161_q1","why can't I see init container logs when my main container starts successfully","tasks_debug_debug-application_debug-init-containers",3,387.36,2,101.95,3,45.22
"q_161_q2","kubernetes pod failed and I need to understand what happened during startup","tasks_debug_debug-application_debug-init-containers",,255.37,,105.91,,45.40
"q_162_q1","how to prevent job from restarting when a pod fails during a cluster upgrade","tasks_job_pod-failure-policy",4,309.56,4,103.26,2,45.61
"q_162_q2","my batch job keeps failing when a single pod has a temporary issue","tasks_job_pod-failure-policy",,260.66,5,92.55,3,61.61
"q_163_q1","my container says 'file not found' when trying to mount a directory that doesn't exist yet","concepts_storage_volumes",1,279.99,1,80.55,2,49.25
"q_163_q2","how to make kubernetes automatically create missing volume paths for my application","concepts_storage_volumes",,382.82,,111.58,,76.79
"q_164_q1","why can't my kubernetes dashboard user see any resources","reference_access-authn-authz_rbac",,252.32,,86.12,,44.71
"q_164_q2","getting permission denied when trying to list available api resources","reference_access-authn-authz_rbac",,278.06,,55.55,,37.83
"q_165_q1","how to override the default startup command in my docker container when running in kubernetes","tasks_inject-data-application_define-command-argument-container",,262.53,,91.08,,40.72
"q_165_q2","my container keeps crashing because the wrong entrypoint is being used","tasks_inject-data-application_define-command-argument-container",,268.44,,86.22,,33.63
"q_166_q1","why are my kubectl commands suddenly not working after a cluster upgrade","tasks_tools_install-kubectl-linux",,383.48,,84.42,,57.24
"q_166_q2","getting version mismatch warnings between my local kubectl and cluster kubernetes version","tasks_tools_install-kubectl-linux",4,262.74,4,100.07,1,113.69
"q_167_q1","how to check if my kubernetes cluster uses vulnerable container images","tasks_administer-cluster_verify-signed-artifacts",,254.41,,93.96,,32.80
"q_167_q2","verify security of all images running in my production environment","tasks_administer-cluster_verify-signed-artifacts",3,261.54,3,90.59,1,77.98
"q_168_q1","how to run database migration script before my main application starts","concepts_workloads_pods_init-containers",2,254.97,,96.05,,43.30
"q_168_q2","my app needs another container to send logs to external service but don't want to modify main container","concepts_workloads_pods_init-containers",4,384.44,,80.11,3,54.25
"q_169_q1","why does my messaging queue keep dropping messages during high traffic","tasks_job_coarse-parallel-processing-work-queue",,251.18,5,102.83,,78.14
"q_169_q2","can't scale microservices because workers aren't getting events reliably","tasks_job_coarse-parallel-processing-work-queue",,258.07,,75.83,,58.49
"q_170_q1","my application keeps going down when a node crashes; how to ensure it stays running","concepts_workloads_controllers_replicaset",,256.64,,131.91,,70.67
"q_170_q2","how can I automatically run 3 copies of my web service for high availability","concepts_workloads_controllers_replicaset",,288.83,,80.25,,85.14
"q_171_q1","can't get cluster information from my terminal; kubectl not showing anything","tasks_administer-cluster_access-cluster-api",,472.87,2,168.33,,94.06
"q_171_q2","how to list all running pods and services without logging into the dashboard","tasks_administer-cluster_access-cluster-api",,307.88,,143.77,,104.53
"q_172_q1","how can I set up a kubernetes cluster with network policy support","tasks_administer-cluster_network-policy-provider_calico-network-policy",,296.65,4,152.18,1,94.56
"q_172_q2","which method should I use to install calico in my on-premises kubernetes environment","tasks_administer-cluster_network-policy-provider_calico-network-policy",1,305.47,1,152.52,1,110.82
"q_173_q1","how small can i set cpu request to avoid wasting cluster resources on tiny containers","tasks_administer-cluster_manage-resources_cpu-constraint-namespace",,308.58,,197.21,,86.39
"q_173_q2","my container keeps getting killed because of low cpu allocation","tasks_administer-cluster_manage-resources_cpu-constraint-namespace",,490.07,,108.74,,84.77
"q_174_q1","why are my pods not receiving traffic even though the container starts successfully","tasks_configure-pod-container_configure-liveness-readiness-startup-probes",3,301.89,2,146.03,5,141.28
"q_174_q2","kubernetes keeps killing my pod that needs extra time to warm up database connections","tasks_configure-pod-container_configure-liveness-readiness-startup-probes",,350.77,,172.01,,91.71
"q_175_q1","why are my kubectl apply commands failing with validation errors","tasks_extend-kubernetes_custom-resources_custom-resource-definitions",,338.76,,211.69,,97.47
"q_175_q2","how to automatically catch configuration mistakes before deploying to cluster","tasks_extend-kubernetes_custom-resources_custom-resource-definitions",,337.72,,141.96,,83.43
"q_176_q1","why can't my pod access kubernetes api when running inside the cluster","tasks_configure-pod-container_configure-service-account",,578.74,,190.73,,108.16
"q_176_q2","how to give my application permissions to list and create resources","tasks_configure-pod-container_configure-service-account",,319.72,,141.43,,158.42
"q_177_q1","why can't my pods communicate with each other across different nodes","concepts_services-networking_network-policies",,354.67,3,131.53,3,52.01
"q_177_q2","how to troubleshoot network connectivity issues between kubernetes clusters","concepts_services-networking_network-policies",,323.85,,176.71,,143.43
"q_178_q1","why is my deployment getting blocked during rollout with a weird webhook annotation","reference_access-authn-authz_extensible-admission-controllers",5,384.92,4,185.26,3,88.50
"q_178_q2","getting admission webhook errors when trying to deploy new container image","reference_access-authn-authz_extensible-admission-controllers",1,491.75,1,208.07,1,126.61
"q_179_q1","why are my pods getting blocked from running after kubernetes upgrade","reference_access-authn-authz_admission-controllers",,344.23,,146.97,,112.58
"q_179_q2","prevent developers from creating containers with root access or privileged mode","reference_access-authn-authz_admission-controllers",,378.28,,108.22,,117.68
"q_180_q1","how to stop one team from consuming all cluster resources and blocking other teams' workloads","concepts_policy_resource-quotas",,314.19,,159.48,,87.53
"q_180_q2","prevent developers from spinning up massive expensive pods that drain my kubernetes cluster","concepts_policy_resource-quotas",,317.29,,174.23,,125.12
"q_181_q1","why can't my new CRD work and it says the API is not enabled","tasks_administer-cluster_enable-disable-api",,462.85,,148.03,,91.38
"q_181_q2","how to allow newer kubernetes features without upgrading entire cluster","tasks_administer-cluster_enable-disable-api",,300.00,,154.36,,131.41
"q_182_q1","how can I collect container logs from all my kubernetes nodes","concepts_cluster-administration_logging",3,390.06,1,138.65,1,114.17
"q_182_q2","my application logs are disappearing when pods restart and I can't debug","concepts_cluster-administration_logging",,328.74,,171.26,,161.02
"q_183_q1","why are my database pods not scaling down gracefully and causing data loss","tasks_run-application_scale-stateful-set",,455.05,1,107.47,5,116.76
"q_183_q2","kubernetes can't remove last pod in my statefulset without manual intervention","tasks_run-application_scale-stateful-set",,518.30,,116.42,,101.78
"q_184_q1","how to use gpu resources in my machine learning pods without writing complex device configuration","tasks_manage-gpus_scheduling-gpus",1,327.67,1,166.88,1,86.63
"q_184_q2","my container can't access custom hardware like tpu or fpga on kubernetes cluster","tasks_manage-gpus_scheduling-gpus",1,307.55,1,215.54,1,99.24
"q_185_q1","why my service keeps failing and I can't understand the error response","reference_access-authn-authz_authentication",,292.79,,144.47,,114.55
"q_185_q2","how to debug an external api call when something goes wrong with the request","reference_access-authn-authz_authentication",,423.49,,106.61,,78.27
"q_186_q1","why are my cluster's certificates expiring and breaking node connections","tasks_tls_certificate-rotation",1,432.03,5,165.56,,87.12
"q_186_q2","how to automatically renew kubelet certificates before they expire","tasks_tls_certificate-rotation",1,433.90,5,132.09,,113.38
"q_187_q1","why do my kubernetes masters look like they're fighting over leadership","concepts_architecture_leases",,381.06,,139.46,,170.50
"q_187_q2","how to debug why cluster leadership election seems stuck","concepts_architecture_leases",,461.01,,143.83,,122.10
"q_188_q1","how can manually placing pods on specific nodes break my cluster's reliability","concepts_scheduling-eviction_dynamic-resource-allocation",,315.21,,139.64,,109.69
"q_188_q2","my application is not being distributed evenly across nodes after deployment","concepts_scheduling-eviction_dynamic-resource-allocation",,607.03,,191.12,,176.86
"q_189_q1","why do my child resources get deleted when parent resource is removed","concepts_overview_working-with-objects_owners-dependents",,365.75,4,112.74,3,106.37
"q_189_q2","how to prevent automatic deletion of resources when parent resource is deleted","concepts_overview_working-with-objects_owners-dependents",5,313.62,,154.38,,68.76
"q_190_q1","why do my kubernetes service accounts keep getting rejected with authentication errors","reference_access-authn-authz_authentication",,308.43,,140.83,1,96.83
"q_190_q2","how can I create a secure way to authenticate external services to my cluster","reference_access-authn-authz_authentication",,336.23,,191.05,,101.57
"q_191_q1","how to gracefully remove a node from kubernetes cluster without disrupting running workloads","concepts_scheduling-eviction_api-eviction",,436.18,,161.18,,86.84
"q_191_q2","why is kubernetes not automatically moving my pods when I want to drain a problematic node","concepts_scheduling-eviction_api-eviction",,356.03,,220.58,,105.00
"q_192_q1","why are my kubernetes metrics not showing up with custom labels","concepts_cluster-administration_system-metrics",,319.43,,148.06,,126.73
"q_192_q2","getting error when trying to add extra labels to monitoring dashboard","concepts_cluster-administration_system-metrics",,331.37,1,107.42,,101.85
"q_193_q1","how can I protect sensitive data stored in my kubernetes cluster's volumes","tasks_administer-cluster_decrypt-data",,305.62,4,128.38,2,106.53
"q_193_q2","is my database backup safe from unauthorized access if someone gets physical disk access","tasks_administer-cluster_decrypt-data",,527.64,,141.61,,63.17
"q_194_q1","how to extend kubernetes with my own custom resource type for our specific infrastructure","tasks_extend-kubernetes_custom-resources_custom-resource-definitions",,326.22,1,141.46,3,116.59
"q_194_q2","getting an error when trying to define a new resource that tracks our company's specific deployment workflow","tasks_extend-kubernetes_custom-resources_custom-resource-definitions",,366.27,,180.32,,112.03
"q_195_q1","why can't my certificate signing requests get automatically approved in kubernetes","reference_access-authn-authz_certificate-signing-requests",,397.69,1,84.24,2,180.78
"q_195_q2","how to automatically generate and validate tls certificates for my services","reference_access-authn-authz_certificate-signing-requests",,314.39,,149.45,,89.60
"q_196_q1","why is my kubernetes cluster not authenticating with etcd when using certificates","setup_best-practices_certificates",,491.52,,214.90,,225.01
"q_196_q2","getting x509 certificate errors when trying to set up cluster security","setup_best-practices_certificates",,309.68,,155.42,,128.39
"q_197_q1","why did my container exit and how can I see the exact error message","tasks_debug_debug-application_determine-reason-pod-failure",,411.58,,183.06,,72.29
"q_197_q2","is there a way to capture and save the crash reason from a failed pod","tasks_debug_debug-application_determine-reason-pod-failure",5,338.57,,180.23,,94.68
"q_198_q1","how to prevent my critical services from getting killed when the node runs out of resources","concepts_workloads_pods_pod-qos",1,408.54,,232.23,,142.81
"q_198_q2","kubernetes keeps evicting my important pods during high memory usage","concepts_workloads_pods_pod-qos",,514.05,,162.14,,127.10
"q_199_q1","why are my service traffic loadbalancing rules not spreading evenly across zones","concepts_services-networking_topology-aware-routing",,447.64,2,117.50,2,118.72
"q_199_q2","getting unbalanced traffic distribution in multi-zone kubernetes cluster","concepts_services-networking_topology-aware-routing",2,309.78,,144.23,,94.85
